"7",35160097,FALSE,8836939,"10.3390/jcm11030646","./publications/PMC8836939.xml",TRUE,FALSE,TRUE,TRUE,"10.3390/jcm11030646",FALSE,"",FALSE,"","",TRUE,FALSE,8836939,"10.3390/jcm11030646","./publications/PMC8836939.xml","Journal of Clinical Medicine","MDPI","","",2022,0,TRUE,"Conflicts of Interest The authors declare no conflict of interest.",FALSE,TRUE,TRUE,TRUE,FALSE,FALSE,FALSE,FALSE,FALSE,FALSE,FALSE,FALSE,FALSE,FALSE,FALSE,FALSE,FALSE,FALSE,FALSE,FALSE,FALSE,FALSE,FALSE,FALSE,FALSE,FALSE,TRUE,"Funding Equipment was provided by the manufacturer (Ambu GmbH, Bad Nauheim, Germany) for free and was returned after the completion of the study. No other sponsoring was received.","","","",FALSE,TRUE,FALSE,FALSE,TRUE,FALSE,FALSE,FALSE,FALSE,FALSE,FALSE,FALSE,FALSE,FALSE,FALSE,FALSE,FALSE,FALSE,FALSE,FALSE,FALSE,FALSE,FALSE,FALSE,FALSE,FALSE,FALSE,FALSE,FALSE,FALSE,FALSE,FALSE,FALSE,FALSE,FALSE,FALSE,FALSE,FALSE,FALSE,FALSE,FALSE,TRUE,"This study was registered on ClinicalTrials.gov (NCT04354883, 21 April 2020) and authorized by the ethical committee of the University Hospital of Cologne (19-1069_1, date: 1 April 2019). Background: Although there have been no reported cardiac arrests in space to date, the risk of severe medical events occurring during long-duration spaceflights is a major concern. These critical events can endanger both the crew as well as the mission and include cardiac arrest, which would require cardiopulmonary resuscitation (CPR). Thus far, five methods to perform CPR in microgravity have been proposed. However, each method seems insufficient to some extent and not applicable at all locations in a spacecraft. The aim of the present study is to describe and gather data for two new CPR methods in microgravity. Materials and Methods: A randomized, controlled trial (RCT) compared two new methods for CPR in a free-floating underwater setting. Paramedics performed chest compressions on a manikin (Ambu Man, Ambu, Germany) using two new methods for a free-floating position in a parallel-group design. The first method (Schmitz–Hinkelbein method) is similar to conventional CPR on earth, with the patient in a supine position lying on the operator’s knees for stabilization. The second method (Cologne method) is similar to the first, but chest compressions are conducted with one elbow while the other hand stabilizes the head. The main outcome parameters included the total number of chest compressions (n) during 1 min of CPR (compression rate), the rate of correct chest compressions (%), and no-flow time (s). The study was registered on clinicaltrials.gov (NCT04354883). Results: Fifteen volunteers (age 31.0 ± 8.8 years, height 180.3 ± 7.5 cm, and weight 84.1 ± 13.2 kg) participated in this study. Compared to the Cologne method, the Schmitz–Hinkelbein method showed superiority in compression rates (100.5 ± 14.4 compressions/min), correct compression depth (65 ± 23%), and overall high rates of correct thoracic release after compression (66% high, 20% moderate, and 13% low). The Cologne method showed correct depth rates (28 ± 27%) but was associated with a lower mean compression rate (73.9 ± 25.5/min) and with lower rates of correct thoracic release (20% high, 7% moderate, and 73% low). Conclusions: Both methods are feasible without any equipment and could enable immediate CPR during cardiac arrest in microgravity, even in a single-helper scenario. The Schmitz–Hinkelbein method appears superior and could allow the delivery of high-quality CPR immediately after cardiac arrest with sufficient quality.","research-article",TRUE,FALSE,FALSE,TRUE,TRUE,TRUE,TRUE,FALSE,TRUE,FALSE,FALSE,FALSE,FALSE,FALSE,FALSE,FALSE,FALSE,FALSE,FALSE,FALSE,FALSE,FALSE,FALSE,FALSE,FALSE,FALSE,FALSE,TRUE,"Randomized Comparison of Two New Methods for Chest Compressions during CPR in Microgravity-A Manikin Study","Schmitz J, Ahlbäck A, DuCanto J, Kerkhoff S, Komorowski M, Löw V, Russomano T, Starck C, Thierry S, Warnecke T, Hinkelbein J.","J Clin Med. 2022 Jan 27;11(3):646. doi: 10.3390/jcm11030646.","Schmitz J","J Clin Med",2022,"2/15/22","PMC8836939","","10.3390/jcm11030646"
"8",35574450,FALSE,9094410,"10.3389/fphys.2022.801448","./publications/PMC9094410.xml",TRUE,FALSE,TRUE,TRUE,"10.3389/fphys.2022.801448",FALSE,"",FALSE,"","",TRUE,FALSE,9094410,"10.3389/fphys.2022.801448","./publications/PMC9094410.xml","Frontiers in Physiology","Frontiers Media S.A.","INSERM, U 1059, University of Saint-Etienne; University of Lyon; Institute of Space Physiology and Medicine (MEDES); Biochemical Analysis Laboratory; University Hospital; French Space Agency (CNES)","France; France; France; France",2022,0,TRUE,"Conflict of Interest The authors declare that the research was conducted in the absence of any commercial or financial relationships that could be construed as a potential conflict of interest.",FALSE,TRUE,TRUE,TRUE,FALSE,FALSE,FALSE,FALSE,FALSE,FALSE,FALSE,FALSE,FALSE,FALSE,FALSE,FALSE,FALSE,FALSE,FALSE,FALSE,FALSE,FALSE,FALSE,FALSE,FALSE,FALSE,TRUE,"Funding This dry immersion protocol was supported by CNES (DAR CNES N◦ 2018 – 4800000970).","Centre National d’Etudes Spatiales
","Centre National d’Etudes Spatiales
10.13039/501100002830","",TRUE,TRUE,FALSE,FALSE,TRUE,FALSE,FALSE,FALSE,FALSE,FALSE,FALSE,FALSE,FALSE,FALSE,FALSE,FALSE,FALSE,FALSE,FALSE,FALSE,FALSE,FALSE,FALSE,FALSE,FALSE,FALSE,FALSE,FALSE,FALSE,FALSE,FALSE,FALSE,FALSE,FALSE,FALSE,FALSE,FALSE,FALSE,FALSE,FALSE,FALSE,TRUE,"Twenty healthy men were recruited. Two subjects withdrew from the study before the start of their experimental period for reasons unrelated to the protocol. A total of eighteen subjects were included in the study. A period of 4 days before immersion was applied in order to proceed to the basal data collection (BDC). Subjects were randomly allotted at BDC-2 to Dry Immersion (DI) or Dry Immersion with thigh Cuffs (DI-TC) group (9/9 split). All subjects were informed about the experimental procedures and gave their written consent. The experimental protocol conformed to the standards set by the Declaration of Helsinki and was approved by the local Ethic Committee (CPP Est III: October 2, 2018, n° ID RCB 2018-A01470-55) and French Health Authorities (ANSM: August 13, 2018). ClinicalTrials.gov Identifier: NCT03915457.","research-article",TRUE,FALSE,FALSE,TRUE,TRUE,TRUE,FALSE,FALSE,FALSE,FALSE,FALSE,FALSE,FALSE,FALSE,FALSE,FALSE,FALSE,FALSE,FALSE,FALSE,FALSE,FALSE,FALSE,FALSE,FALSE,TRUE,FALSE,TRUE,"DI-5-Cuffs: Bone Remodelling and Associated Metabolism Markers in Humans After Five Days of Dry Immersion to Simulate Microgravity","Linossier MT, Peurière L, Fernandez P, Normand M, Beck A, Bareille MP, Bonneau C, Gauquelin-Koch G, Vico L.","Front Physiol. 2022 Apr 27;13:801448. doi: 10.3389/fphys.2022.801448. eCollection 2022.","Linossier MT","Front Physiol",2022,"5/16/22","PMC9094410","","10.3389/fphys.2022.801448"
"9",36160844,FALSE,9492851,"10.3389/fphys.2022.976926","./publications/PMC9492851.xml",TRUE,FALSE,TRUE,TRUE,"10.3389/fphys.2022.976926",FALSE,"",FALSE,"","",TRUE,FALSE,9492851,"10.3389/fphys.2022.976926","./publications/PMC9492851.xml","Frontiers in Physiology","Frontiers Media S.A.","KBR; Institute of Aerospace Medicine; German Aerospace Center","United States; Germany",2022,0,TRUE,"Conflict of interest Author GC was employed by the company KBR. The remaining authors declares that the research was conducted in the absence of any commercial or financial relationships that could be construed as a potential conflict of interest.",FALSE,TRUE,TRUE,TRUE,FALSE,FALSE,FALSE,FALSE,FALSE,FALSE,FALSE,FALSE,FALSE,FALSE,FALSE,FALSE,FALSE,FALSE,FALSE,FALSE,FALSE,FALSE,FALSE,FALSE,FALSE,FALSE,TRUE,"Funding The study was funded by the German Aerospace Center, the European Space Agency (Contract Number 4000113871/15/NL/PG) and the National Aeronautics and Space Administration (Contract Number 80JSC018P0078), and performed at the:envihab research facility of the DLR Institute of Aerospace Medicine.","Johnson Space Center
; Deutsche Agentur für Raumfahrtangelegenheiten
; European Space Agency
","Johnson Space Center
10.13039/100006203; Deutsche Agentur für Raumfahrtangelegenheiten
10.13039/501100018755; European Space Agency
10.13039/501100000844","",TRUE,TRUE,FALSE,FALSE,TRUE,FALSE,FALSE,FALSE,FALSE,FALSE,FALSE,FALSE,FALSE,FALSE,FALSE,FALSE,FALSE,FALSE,FALSE,FALSE,FALSE,FALSE,FALSE,FALSE,FALSE,FALSE,FALSE,FALSE,FALSE,FALSE,FALSE,FALSE,FALSE,FALSE,FALSE,FALSE,FALSE,FALSE,FALSE,FALSE,FALSE,TRUE,"Studies from ESA, NASA, and DLR were approved by their local institutional review boards. In addition, a protocol reflecting the integrated experiments was approved by the ethics commission of the local medical association (number 2018143, Ärztekammer Nordrhein) in Duesseldorf, Germany, as well as the Federal Office for Radiation Protection (number Z 5-22464/2018-074-R-G, Bundesamt für Strahlenschutz). The study was prospectively registered at the German Clinical Trials Register under number DRKS00015677.","research-article",TRUE,FALSE,FALSE,TRUE,TRUE,FALSE,TRUE,FALSE,TRUE,FALSE,FALSE,FALSE,FALSE,FALSE,FALSE,FALSE,FALSE,FALSE,FALSE,FALSE,FALSE,FALSE,FALSE,FALSE,FALSE,FALSE,FALSE,TRUE,"Assessing the effects of artificial gravity in an analog of long-duration spaceflight: The protocol and implementation of the AGBRESA bed rest study","Clément G, Rittweger J, Nitsche A, Doering W, Frings-Meuthen P, Hand O, Frett T, Noppe A, Paulke F, Lecheler L, Jordan J, Stern C, Mulder E.","Front Physiol. 2022 Sep 8;13:976926. doi: 10.3389/fphys.2022.976926. eCollection 2022.","Clément G","Front Physiol",2022,"9/26/22","PMC9492851","","10.3389/fphys.2022.976926"
"10",36213230,FALSE,9532525,"10.3389/fphys.2022.943630","./publications/PMC9532525.xml",TRUE,FALSE,TRUE,TRUE,"10.3389/fphys.2022.943630",FALSE,"",FALSE,"","",TRUE,FALSE,9532525,"10.3389/fphys.2022.943630","./publications/PMC9532525.xml","Frontiers in Physiology","Frontiers Media S.A.","Department of Biomedical Physiology and Kinesiology; Aerospace Physiology Laboratory; Simon Fraser University; Biomedical Engineering Program; University of North Dakota","Canada; United States",2022,0,TRUE,"Conflict of interest The authors declare that the research was conducted in the absence of any commercial or financial relationships that could be construed as a potential conflict of interest.",FALSE,TRUE,TRUE,TRUE,FALSE,FALSE,FALSE,FALSE,FALSE,FALSE,FALSE,FALSE,FALSE,FALSE,FALSE,FALSE,FALSE,FALSE,FALSE,FALSE,FALSE,FALSE,FALSE,FALSE,FALSE,FALSE,TRUE,"Funding This study was supported by the Canadian Institute of Health Research (CIHR) as a consortium with Canadian Space Agency (CSA) and Canadian Frailty Network (CFN) within the “Understanding the Health Impact of Inactivity” program. APB was the PI and KT a CoI. The project title was “From orbit to bedside: using space-based bed-rest techniques to study cardiovascular and skeletal muscle-pump orthostatic reflexes with and without a strength and HIIT exercise intervention to prevent falls in older patients after hospitalization.” Funds for open access fees were provided by the Simon Fraser Open Access Fund and CIHR. The study was part of the clinical trial: Understanding the Negative Effects of Bed Rest and Using Exercise as a Countermeasure (https://clinicaltrials.gov/ct2/show/NCT04964999).","Canadian Institutes of Health Research
","Canadian Institutes of Health Research
10.13039/501100000024","",TRUE,TRUE,FALSE,FALSE,TRUE,FALSE,FALSE,FALSE,FALSE,FALSE,FALSE,FALSE,FALSE,FALSE,FALSE,FALSE,FALSE,FALSE,FALSE,FALSE,FALSE,FALSE,FALSE,FALSE,FALSE,FALSE,FALSE,FALSE,FALSE,FALSE,FALSE,FALSE,FALSE,FALSE,FALSE,FALSE,FALSE,FALSE,FALSE,FALSE,FALSE,TRUE,"Overall ethical approval for CAIS was obtained from the research ethics board of the MHUC. The study was registered as a clinical trial (NCT04964999: Microgravity Research Analogue (MRA): Understanding the Health Impact of Inactivity for the Benefit of Older Adults and Astronauts Initiative) in the US National clinical trial registry. Research and data collection associated with our component of the study was approved by the Office of Research Ethics at Simon Fraser University. The participants signed a written informed consent and agreed to be available at MHUC for the entire 26 days study period. The research was conducted in compliance with the guidelines and regulations of the above agencies and the declaration of Helsinki.","research-article",TRUE,FALSE,FALSE,TRUE,TRUE,TRUE,TRUE,FALSE,TRUE,FALSE,FALSE,TRUE,FALSE,FALSE,FALSE,FALSE,FALSE,FALSE,FALSE,FALSE,FALSE,FALSE,FALSE,FALSE,FALSE,FALSE,FALSE,TRUE,"Canadian aging and inactivity study: Spaceflight-inspired exercises during head-down tilt bedrest blunted reductions in muscle-pump but not cardiac baroreflex in older persons","Sadeghian F, Divsalar DN, Fadil R, Tavakolian K, Blaber AP.","Front Physiol. 2022 Sep 21;13:943630. doi: 10.3389/fphys.2022.943630. eCollection 2022.","Sadeghian F","Front Physiol",2022,"10/10/22","PMC9532525","","10.3389/fphys.2022.943630"
